{
  "$schema": "http://json-schema.org/draft-07/schema#",
  "description": "GET request that returns transactions",
  "title": "TransactionResults",
  "type": "object",
  "required": ["results", "limit", "offset", "total"],
  "properties": {
    "limit": {
      "type": "integer"
    },
    "offset": {
      "type": "integer"
    },
    "total": {
      "type": "integer"
    },
    "results": {
      "type": "array",
      "items": {
        "$ref": "../../entities/transactions/transaction.schema.json"
      }
    }
  }
}
